{
 "schema": 1,
 "id": "bivb",
 "type": "org",
 "names": {
  "name": "BIVB",
  "aliases": [
   "Bureau Interprofessionnel des Vins de Bourgogne"
  ]
 },
 "region": [
  "burgundy"
 ],
 "facets": {
  "country": "France",
  "kind": "association",
  "status": "open"
 },
 "text": {
  "what": "Burgundy's trade body: the growers, the négociants and the appellation statistics, in one office in Beaune."
 },
 "kin": [
  {
   "to": "burgundy",
   "as": "Whose numbers it publishes.",
   "rel": "region"
  },
  {
   "to": "negociant",
   "as": "One half of the trade it represents.",
   "rel": "term"
  }
 ],
 "geo": {
  "lat": 47.024,
  "lon": 4.84,
  "precision": "town"
 },
 "sources": [
  "s:wp-burgundy-wine"
 ],
 "provenance": {
  "default": {
   "tier": "tradition"
  }
 },
 "confidence": "medium",
 "updated": "2026-09-16"
}
