{
 "schema": 1,
 "id": "ahr",
 "type": "region",
 "names": {
  "name": "Ahr"
 },
 "region": [
  "ahr",
  "germany"
 ],
 "facets": {
  "country": "Germany",
  "level": "region",
  "soil": "slate, basalt, greywacke"
 },
 "text": {
  "what": "A narrow slate valley south of Bonn, among the smallest German regions and the one that gives more of its ground to spätburgunder than any other.",
  "story": "Steep terraces on a river that runs east-west, this far north, on dark stone that holds the day's heat. The July 2021 flood tore through the valley and its cellars; growers were still rebuilding years after."
 },
 "kin": [
  {
   "to": "pinot-noir",
   "as": "Called spätburgunder here, and grown in a higher share than anywhere else in Germany.",
   "rel": "variety"
  },
  {
   "to": "fruhburgunder",
   "as": "The early-ripening cousin the valley kept.",
   "rel": "variety"
  },
  {
   "to": "baden",
   "as": "The other German pinot region, warmer and far larger.",
   "rel": "neighbour"
  }
 ],
 "geo": {
  "lat": 50.54,
  "lon": 7.05,
  "precision": "region"
 },
 "sources": [
  "s:wp-ahr-wine-region",
  "s:wp-german-wine"
 ],
 "provenance": {
  "default": {
   "tier": "cited"
  },
  "fields": {
   "text.story": {
    "tier": "tradition",
    "note": "the 2021 flood is general knowledge here, not taken from the corpus"
   }
  }
 },
 "measures": [
  {
   "key": "hectares",
   "label": "Vineyard",
   "value": 558,
   "unit": "ha",
   "year": 2008,
   "source": "s:wp-ahr-wine-region",
   "tier": "cited"
  }
 ],
 "confidence": "medium",
 "updated": "2026-09-16",
 "images": [
  {
   "file": "ahr/ahr-vineyard-in-the-ahr-valley-germany.jpg",
   "source": "commons",
   "title": "File:Vineyard in the Ahr Valley, Germany.jpg",
   "url": "https://upload.wikimedia.org/wikipedia/commons/7/78/Vineyard_in_the_Ahr_Valley%2C_Germany.jpg?utm_source=commons.wikimedia.org&utm_campaign=imageinfo&utm_content=original",
   "page_url": "https://commons.wikimedia.org/wiki/File%3AVineyard_in_the_Ahr_Valley%2C_Germany.jpg",
   "license": "CC0 1.0",
   "license_url": "https://creativecommons.org/publicdomain/zero/1.0/",
   "author": "1998alexkane",
   "credit": "Own work",
   "alt": "vineyard in the Ahr Valley, Germany",
   "date": "19 November 2023 (according to Exif data",
   "primary": true,
   "sha256": "cd2be5efe09af644774ea3d7ed119d97737cfa03ccaeae581019556c2c0ca3e4"
  }
 ]
}
